{
  "v": 0,
  "sid": "sess-vector",
  "created": "2026-10-29T10:00:00+00:00",
  "trigger": "checkpoint",
  "cwd": "/work/project",
  "saved_at": "2026-10-29T10:00:05+00:00",
  "armed": true,
  "files": [
    {
      "path": "/work/project/a.py",
      "lines": 42,
      "edited": false,
      "t": 1761732000.0
    },
    {
      "path": "/work/project/b.py",
      "lines": null,
      "edited": true,
      "t": 1761732001.0
    }
  ],
  "folds": [],
  "commands": [],
  "todos": []
}
