{
  "v": 0,
  "sid": "sess-vector",
  "created": "2026-10-29T10:00:00+00:00",
  "trigger": "checkpoint",
  "cwd": "/work/project",
  "saved_at": "2026-10-29T10:00:05+00:00",
  "armed": true,
  "files": [],
  "folds": [],
  "commands": [
    "uv run pytest -q",
    "git status --short",
    "export API_TOKEN=***"
  ],
  "todos": []
}
